{
  "module": {
    "name": "actuator"
  },
  "local_storages": [
    {
      "name": "buf",
      "size": 32
    }
  ],
  "external_storages": [
    {
      "name": "buf",
      "source_module": "sensor"
    }
  ],
  "items": [
    {
      "name": "status",
      "data_type": "counter",
      "storages": ["buf"]
    }
  ]
}
